{
  "eventId": "evt_channelpublicationreserved_001",
  "eventType": "ChannelPublicationReserved",
  "schemaVersion": 1,
  "occurredAt": "2026-08-10T02:00:00Z",
  "publishedAt": "2026-08-10T02:00:01Z",
  "producer": "SYS-08",
  "environment": "DEV",
  "audience": [
    "SYS-05",
    "SYS-06"
  ],
  "enterpriseId": "ent_contract_001",
  "aggregateType": "PublicationChargeReservation",
  "aggregateId": "pcr_contract_001",
  "aggregateVersion": 1,
  "traceId": "trace_contract_fixture_001",
  "causationId": null,
  "correlationId": "corr_contract_fixture_001",
  "idempotencyKey": "PUBLICATION_CHARGE:cpub_contract_001",
  "payload": {
    "chargeReservationId": "pcr_contract_001",
    "enterpriseId": "ent_contract_001",
    "publicationPlanId": "pplan_contract_001",
    "channelPublicationId": "cpub_contract_001",
    "channel": "DOUYIN",
    "sourceType": "PUBLICATION_SERVICE_ORDER",
    "quotaBatchId": null,
    "serviceOrderId": "pso_contract_001",
    "paymentId": "pay_service_contract_001",
    "authorizedBalanceRef": null,
    "sourceVersion": 1,
    "expiresAt": "2026-08-10T03:00:00Z",
    "reservedAt": "2026-08-10T02:00:00Z"
  }
}
